{"candidate_sources":[{"candidate_original_study":"Dyrby et al. 2002 pharmaceutical tablets","dataset_id":"ucph_tablet_nir","outcomes_accessed":false,"reference_and_assay_ownership":"awaiting_original_key_audit","role":"not_admitted_yet","source_metadata_ref":"https://ucphchemometrics.com/tablet/"},{"candidate_original_study":"Rinnan and Rinnan 2007 Abisko soil: 36 plots, three subsamples","dataset_id":"ohpl_soil_nir","outcomes_accessed":false,"reference_and_assay_ownership":"awaiting_original_key_audit","role":"not_admitted_yet","source_metadata_ref":"https://ucphchemometrics.com/soilnir/"},{"candidate_original_study":"Norgaard et al. 2000 original beer experiment","dataset_id":"ohpl_beer_nir","outcomes_accessed":false,"reference_and_assay_ownership":"awaiting_original_key_audit","role":"not_admitted_yet","source_metadata_ref":"https://github.com/nanxstats/OHPL/blob/master/man/beer.Rd"},{"candidate_original_study":"Kalivas 1997 original wheat experiment","dataset_id":"ohpl_wheat_nir","outcomes_accessed":false,"reference_and_assay_ownership":"awaiting_original_key_audit","role":"not_admitted_yet","source_metadata_ref":"https://github.com/nanxstats/OHPL/blob/master/man/wheat.Rd"}],"confirmation_power":{"reason":"INDEPENDENT_SOURCE_COHORT_DESCRIPTOR_VARIATION_REFERENCE_OWNERSHIP_AND_OUTCOME_NOISE_NOT_YET_QUALIFIED","status":"insufficient_information","value":null},"contract_id":"9ecc06b1cf1bab666704b4c7e343cd65ec44ee2eaffe3b671ab4fe31a36c21ba","descriptor_bindings":[{"admissible_falsification":["Supported stable separation with good transfer","Unstable partitions with fragile prediction"],"controls":["Exact target definition and units","Whole physical/reference dependency components","Matched training size and evaluation IDs","Independent study/group counts","Target-range extrapolation and composition","Frozen model family/preprocessing","Fold-local fit/selection/refit; retained targets sealed"],"descriptor_paths":["structural_stability.summary_refs -> settings[min_cluster_size=8,12].value.ari_summary/ari_p10/noise_agreement_p10/cluster_pair_support","alpha13 conditions[raw,snv;fraction=.6,.8] -> domains.stability_power.v0.2 settings[8,12]"],"effective_independent_support":"Independent original studies for confirmation; physical/assay groups within a study are not additional studies.","future_response":"Matched D_RMSE and D_skill under admissible structural versus reference designs.","hypothesis_id":"H1","missingness_rule":"Unavailable/insufficient/nontrivial support failures remain missing, never favorable zero; no post-response family selection.","population_scope":"Exact source/content/observation population; study relations and query support retained.","primary_descriptor_ids":["stability.raw.six","stability.raw.eight","stability.snv.six","stability.snv.eight"],"provider":"Methods 1.3.6 / ABI 2.19 through public Preflight; DAG-ML 0.3.41 for any later admitted model.","qualitative_prediction":"Better-supported separation may anticipate greater structural-holdout deterioration.","representation_and_scale":"Raw/SNV, both fractions and both fixed parameters; original and revised support protocols retain distinct versions.","secondary_policy":"Other locked parameter/radius/representation descriptors are exploratory secondary comparisons; no selection by future scores."},{"admissible_falsification":["Strong overlap without reference advantage","Weak overlap with good transfer"],"controls":["Exact target definition and units","Whole physical/reference dependency components","Matched training size and evaluation IDs","Independent study/group counts","Target-range extrapolation and composition","Frozen model family/preprocessing","Fold-local fit/selection/refit; retained targets sealed"],"descriptor_paths":["representations.raw.value.neighborhoods.full_axis.relative_proximity[radius=.01].fraction","Separately admitted train-fitted evaluation-neighbor analogue, never a full-source substitution"],"effective_independent_support":"Independent original studies for confirmation; physical/assay groups within a study are not additional studies.","future_response":"Matched D_RMSE/D_skill under independently admitted population transfer.","hypothesis_id":"H2","missingness_rule":"Unavailable/insufficient/nontrivial support failures remain missing, never favorable zero; no post-response family selection.","population_scope":"Exact source/content/observation population; study relations and query support retained.","primary_descriptor_ids":["raw.full_axis.radius_0.01.fraction"],"provider":"Methods 1.3.6 / ABI 2.19 through public Preflight; DAG-ML 0.3.41 for any later admitted model.","qualitative_prediction":"Strong neighborhood overlap may favor in-support evaluation relative to genuine transfer.","representation_and_scale":"k=8 identity neighborhoods; distance/sqrt(full representation covariance trace); exact census and sampled queries kept distinct.","secondary_policy":"Other locked parameter/radius/representation descriptors are exploratory secondary comparisons; no selection by future scores."},{"admissible_falsification":["Large geometric change with negligible model-response interaction","Similar responses across pipelines despite structural disagreement"],"controls":["Exact target definition and units","Whole physical/reference dependency components","Matched training size and evaluation IDs","Independent study/group counts","Target-range extrapolation and composition","Frozen model family/preprocessing","Fold-local fit/selection/refit; retained targets sealed"],"descriptor_paths":["representation_agreement.value.partitions[0].value.ari_including_noise","representation_agreement.value.full_axis_neighbors.metrics[k=8].set_overlap.mean"],"effective_independent_support":"Independent original studies for confirmation; physical/assay groups within a study are not additional studies.","future_response":"D_RMSE_PLS minus D_RMSE_Ridge, plus prespecified raw/SNV interaction on matched IDs.","hypothesis_id":"H3","missingness_rule":"Unavailable/insufficient/nontrivial support failures remain missing, never favorable zero; no post-response family selection.","population_scope":"Exact source/content/observation population; study relations and query support retained.","primary_descriptor_ids":["raw_snv.primary_partition_ari","raw_snv.full_axis.k8_set_overlap"],"provider":"Methods 1.3.6 / ABI 2.19 through public Preflight; DAG-ML 0.3.41 for any later admitted model.","qualitative_prediction":"Representation disagreement may anticipate pipeline-specific structural sensitivity.","representation_and_scale":"Identical original observations/axes and query IDs; raw/SNV fixed without HPO.","secondary_policy":"Other locked parameter/radius/representation descriptors are exploratory secondary comparisons; no selection by future scores."},{"admissible_falsification":["Large support shifts with little deterioration","Predictions survive extrapolation despite weak group evidence"],"controls":["Exact target definition and units","Whole physical/reference dependency components","Matched training size and evaluation IDs","Independent study/group counts","Target-range extrapolation and composition","Frozen model family/preprocessing","Fold-local fit/selection/refit; retained targets sealed"],"descriptor_paths":["representations[raw,snv].value.pca.pc1_fraction/retained_variance_fraction","Separately qualified train-fitted continuous spectral support"],"effective_independent_support":"Independent original studies for confirmation; physical/assay groups within a study are not additional studies.","future_response":"Matched error/skill deterioration under prespecified support changes.","hypothesis_id":"H4","missingness_rule":"Unavailable/insufficient/nontrivial support failures remain missing, never favorable zero; no post-response family selection.","population_scope":"Exact source/content/observation population; study relations and query support retained.","primary_descriptor_ids":["raw.pca.pc1_fraction","raw.pca.retained_variance_fraction","snv.pca.pc1_fraction","snv.pca.retained_variance_fraction"],"provider":"Methods 1.3.6 / ABI 2.19 through public Preflight; DAG-ML 0.3.41 for any later admitted model.","qualitative_prediction":"Continuous support extrapolation may matter without credible discrete groups.","representation_and_scale":"At most 20 PCs with independent full trace; within-source dimensionless fractions.","secondary_policy":"Other locked parameter/radius/representation descriptors are exploratory secondary comparisons; no selection by future scores."},{"admissible_falsification":["Initially uncertain close objects verified independent without validity change","Closure has no apparent-performance effect under an admissible paired design"],"controls":["Exact target definition and units","Whole physical/reference dependency components","Matched training size and evaluation IDs","Independent study/group counts","Target-range extrapolation and composition","Frozen model family/preprocessing","Fold-local fit/selection/refit; retained targets sealed"],"descriptor_paths":["representations[raw,snv].value.neighborhoods.full_axis.relative_proximity","identity_evidence and original physical/reference closure proofs"],"effective_independent_support":"Independent original studies for confirmation; physical/assay groups within a study are not additional studies.","future_response":"Dependency-closure and split-validity audit; not a forced error-correlation endpoint.","hypothesis_id":"H5","missingness_rule":"Unavailable/insufficient/nontrivial support failures remain missing, never favorable zero; no post-response family selection.","population_scope":"Exact source/content/observation population; study relations and query support retained.","primary_descriptor_ids":["full_axis.seven_registered_proximity_radii","independently_audited_identity_tier"],"provider":"Methods 1.3.6 / ABI 2.19 through public Preflight; DAG-ML 0.3.41 for any later admitted model.","